鄉鎮市區,交易標的,土地位置建物門牌,土地移轉總面積平方公尺,都市土地使用分區,非都市土地使用分區,非都市土地使用編定,交易年月日,交易筆棟數,移轉層次,總樓層數,建物型態,主要用途,主要建材,建築完成年月,建物移轉總面積平方公尺,建物現況格局-房,建物現況格局-廳,建物現況格局-衛,建物現況格局-隔間,有無管理組織,總價元,單價元平方公尺,車位類別,車位移轉總面積(平方公尺),車位總價元,備註,編號,主建物面積,附屬建物面積,陽台面積,電梯,移轉編號
The villages and towns urban district,transaction sign,land sector position building sector house number plate,land shifting total area square meter,the use zoning or compiles and checks,the non-metropolis land use district,non-metropolis land use,transaction year month and day,transaction pen number,shifting level,total floor number,building state,main use,main building materials,construction to complete the years,building shifting total area,Building present situation pattern - room,building present situation pattern - hall,building present situation pattern - health,building present situation pattern - compartmented,Whether there is manages the organization,total price NTD,the unit price (NTD / square meter),the berth category,berth shifting total area square meter,the berth total price NTD,the note,serial number,,,,,
東引鄉,土地,東引西段487地號,66.58,住,,,1060202,土地1建物0車位0,,,其他,,,,0.0,0,0,0,有,無,312926,4700,,0.0,0,含未登記建物,RPPNMLSKKHMFFAZ47DA,0.0,0.0,0.0,,
南竿鄉,土地,復興段879-1地號,293.07,其他,,,1060221,土地2建物0車位0,,,其他,,,,0.0,0,0,0,有,無,1160231,3959,,0.0,0,,RPPNMLRJLHMFFAZ37DA,0.0,0.0,0.0,,
南竿鄉,土地,復興段878-1地號,87.65,其他,,,1060221,土地1建物0車位0,,,其他,,,,0.0,0,0,0,有,無,411955,4700,,0.0,0,,RPQNMLRJLHMFFAZ47DA,0.0,0.0,0.0,,
北竿鄉,土地,橋仔段234地號,109.88,住,,,1060327,土地1建物0車位0,,,其他,,,,0.0,0,0,0,有,無,450000,4095,,0.0,0,,RPPNMLLJNHMFFAZ96DA,0.0,0.0,0.0,,
南竿鄉,土地,清水段396地號,21.15,其他,,,1060327,土地1建物0車位0,,,其他,,,,0.0,0,0,0,有,無,121382,5739,,0.0,0,,RPPNMLPLMHMFFAZ47DA,0.0,0.0,0.0,,
南竿鄉,土地,福沃段514地號,3.99,其他,,,1060324,土地1建物0車位0,,,其他,,,,0.0,0,0,0,有,無,3380,847,,0.0,0,,RPPNMLRKMHMFFAZ57DA,0.0,0.0,0.0,,
南竿鄉,土地,仁愛段495地號,40.53,其他,,,1060331,土地1建物0車位0,,,其他,,,,0.0,0,0,0,有,無,229197,5655,,0.0,0,,RPPNMLTKMHMFFAZ77DA,0.0,0.0,0.0,,
