鄉鎮市區,交易標的,土地位置建物門牌,土地移轉總面積平方公尺,都市土地使用分區,非都市土地使用分區,非都市土地使用編定,交易年月日,交易筆棟數,移轉層次,總樓層數,建物型態,主要用途,主要建材,建築完成年月,建物移轉總面積平方公尺,建物現況格局-房,建物現況格局-廳,建物現況格局-衛,建物現況格局-隔間,有無管理組織,總價元,單價元平方公尺,車位類別,車位移轉總面積(平方公尺),車位總價元,備註,編號,主建物面積,附屬建物面積,陽台面積,電梯,移轉編號
The villages and towns urban district,transaction sign,land sector position building sector house number plate,land shifting total area square meter,the use zoning or compiles and checks,the non-metropolis land use district,non-metropolis land use,transaction year month and day,transaction pen number,shifting level,total floor number,building state,main use,main building materials,construction to complete the years,building shifting total area,Building present situation pattern - room,building present situation pattern - hall,building present situation pattern - health,building present situation pattern - compartmented,Whether there is manages the organization,total price NTD,the unit price (NTD / square meter),the berth category,berth shifting total area square meter,the berth total price NTD,the note,serial number,,,,,
嘉義市,房地(土地+建物),嘉義市嘉義市保成路１６３號,103.0,住,,,1090401,土地1建物1車位0,全,三層,透天厝,見其他登記事項,見其他登記事項,1090214,205.77,4,2,4,有,無,13700000,66579,,0.0,0,,RPXOMLOKNHPFFAI76CA,188.88,0.0,16.89,,
嘉義市,房地(土地+建物),嘉義市嘉義市自強街１９５巷３２號,18.53,住,,,1090424,土地3建物1車位0,一層,七層,華廈(10層含以下有電梯),住家用,鋼筋混凝土造,0800620,97.02,3,2,2,有,有,3100000,31952,,0.0,0,,RPOOMLTKNHPFFAI98CA,73.72,0.0,11.85,,
嘉義市,土地,湖子內段湖內小段89地號,3457.0,農,,,1090320,土地1建物0車位0,,,其他,,,,0.0,0,0,0,有,無,22000000,6364,,0.0,0,,RPQOMLTKNHPFFAI56CA,0.0,0.0,0.0,,
嘉義市,房地(土地+建物),嘉義市嘉義市吳鳳南路６２１巷２４號,72.0,住,,,1090422,土地1建物1車位0,全,二層,透天厝,住家用,鋼筋混凝土加強磚造,0660305,89.2,3,2,2,有,無,3650000,40919,,0.0,0,,RPRNMLKLNHPFFAI38CA,89.2,0.0,0.0,,
嘉義市,房地(土地+建物),嘉義市嘉義市玉山路１５８巷１１０號九樓之４,9.98,住,,,1090415,土地1建物1車位0,九層,十二層,住宅大樓(11層含以上有電梯),住家用,鋼筋混凝土造,0840711,69.08,2,2,2,有,有,3000000,43428,,0.0,0,,RPTNMLLLNHPFFAI68CA,48.8,0.37,6.36,,
嘉義市,房地(土地+建物),嘉義市嘉義市友忠路９８７號４樓１　,13.1,住,,,1090418,土地2建物1車位0,四層,十二層,住宅大樓(11層含以上有電梯),住家用,鋼筋混凝土造,0870226,99.11,3,2,2,有,有,3388000,34184,,0.0,0,,RPWOMLMKNHPFFAI09CA,65.59,0.0,9.52,,
嘉義市,房地(土地+建物),嘉義市嘉義市大雅路二段234巷26之4號,101.64,住,,,1090411,土地2建物1車位0,全,四層,透天厝,見其他登記事項,鋼筋混凝土造,0901015,247.38,4,2,3,有,有,11000000,44466,,0.0,0,,RPQOMLNLNHPFFAI68CA,194.46,0.0,31.8,,
嘉義市,房地(土地+建物)+車位,嘉義市嘉義市南京東街２１２號九樓之３,18.89,住,,,1081111,土地12建物1車位1,九層,九層,華廈(10層含以下有電梯),見其他登記事項,見其他登記事項,1090108,92.28999999999999,3,2,2,有,有,4530000,49084,坡道機械,0.6,0,增建2房1衛。本案依據建設公司提供之預售契約書登載。,RPVNMLQLNHPFFAI76CA,41.0,0.0,7.53,,
嘉義市,房地(土地+建物)+車位,嘉義市嘉義市興美六路４２５號三樓之１,18.62,住,,,1071113,土地12建物1車位1,三層,九層,華廈(10層含以下有電梯),見其他登記事項,見其他登記事項,1090108,92.41999999999999,3,2,2,有,有,6500000,70331,坡道機械,0.6,0,增建2房1衛。本案依據建設公司提供之預售契約書登載。,RPSOMLQLNHPFFAI56CA,41.0,0.0,7.05,,
嘉義市,房地(土地+建物)+車位,嘉義市嘉義市南京東街２１２號四樓之２,19.89,住,,,1051022,土地12建物1車位1,四層,九層,華廈(10層含以下有電梯),見其他登記事項,見其他登記事項,1090108,96.4,2,2,2,有,有,5510000,57158,坡道機械,0.6,0,增建2房1衛。本案依據建設公司提供之預售契約書登載。,RPUOMLQLNHPFFAI76CA,44.87,0.0,6.72,,
嘉義市,房地(土地+建物)+車位,嘉義市嘉義市南京東街２２０號四樓之３,24.92,住,,,1050920,土地12建物1車位1,四層,九層,華廈(10層含以下有電梯),見其他登記事項,見其他登記事項,1090108,118.93,4,2,2,有,有,6300000,52972,坡道機械,0.6,0,增建2房1衛。本案依據建設公司提供之預售契約書登載。,RPOPMLQLNHPFFAI88CA,60.8,0.0,8.96,,
嘉義市,房地(土地+建物)+車位,嘉義市嘉義市南京東街２２０號三樓之３,24.92,住,,,1050916,土地12建物1車位1,三層,九層,華廈(10層含以下有電梯),見其他登記事項,見其他登記事項,1090108,134.07,0,0,0,無,有,6750000,50347,坡道平面,1.21,0,,RPPPMLQLNHPFFAI98CA,60.8,0.0,8.94,,
嘉義市,房地(土地+建物)+車位,嘉義市嘉義市南京東街２２０號八樓之１,24.95,住,,,1070620,土地12建物1車位1,八層,九層,華廈(10層含以下有電梯),見其他登記事項,見其他登記事項,1090108,118.01,3,1,2,有,有,6500000,55080,坡道機械,0.6,0,增建1房1衛。本案依據建設公司提供之預售契約書登載。,RPQPMLQLNHPFFAI09CA,58.63,0.0,10.3,,
嘉義市,房地(土地+建物),嘉義市嘉義市興美六路４２５號五樓之３,25.8,住,,,1051115,土地12建物1車位0,五層,九層,華廈(10層含以下有電梯),見其他登記事項,見其他登記事項,1090108,120.53,3,2,2,有,有,6160000,51108,,0.0,0,增建2房1衛。1戶外平面車位無配分公設持分。本案依據建設公司提供之預售契約書登載。,RPTPMLQLNHPFFAI76CA,61.56,0.0,8.72,,
嘉義市,房地(土地+建物)+車位,嘉義市嘉義市興美六路４２５號八樓之１,18.63,住,,,1051007,土地12建物1車位1,八層,九層,華廈(10層含以下有電梯),見其他登記事項,見其他登記事項,1090108,92.41999999999999,3,2,2,有,有,4500000,48691,坡道機械,0.6,0,增建2房1衛。本案依據建設公司提供之預售契約書登載。,RPWPMLQLNHPFFAI07CA,41.0,0.0,7.05,,
嘉義市,房地(土地+建物),嘉義市嘉義市南興路259號,28.1,住,,,1090422,土地1建物1車位0,一層,六層,華廈(10層含以下有電梯),住家用,鋼筋混凝土造,0700327,105.06,2,1,1,有,有,3500000,33314,,0.0,0,,RPOOMLKMNHPFFAI28CA,96.28,0.0,0.0,,
嘉義市,房地(土地+建物),嘉義市嘉義市安樂街７５號十樓１,21.96,住,,,1090108,土地2建物1車位0,十層,十二層,住宅大樓(11層含以上有電梯),見其他登記事項,鋼筋混凝土造,0890111,135.76,3,2,2,有,有,5950000,43827,,0.0,0,,RPOPMLLJOHPFFAI28CA,85.75,0.0,15.53,,
嘉義市,土地,遠東段263地號,15200.0,農,,,1081226,土地19建物0車位0,,,其他,,,,0.0,0,0,0,有,無,281131400,18495,,0.0,0,乙工總價222540780元整每坪單價75500元農地總價58590620元整每坪單價35500元,RPUNMLMJOHPFFAI78CA,0.0,0.0,0.0,,
嘉義市,房地(土地+建物),嘉義市嘉義市融和街３號,68.0,住,,,1090406,土地2建物1車位0,全,二層,透天厝,住家用,鋼筋混凝土加強磚造,0611112,120.08,3,2,3,有,無,10000000,83278,,0.0,0,,RPUNMLPKNHPFFAI66EA,120.08,0.0,0.0,,
嘉義市,房地(土地+建物),嘉義市嘉義市芳安路３３７巷２４號三樓２,34.7,住,,,1090331,土地2建物1車位0,三層,五層,公寓(5樓含以下無電梯),住家用,鋼筋混凝土造,0690813,108.29,3,1,2,有,無,914440,8444,,0.0,0,親友、員工或其他特殊關係間之交易。；,RPQOMLOKNHPFFAI88EA,94.43,0.0,0.0,,
嘉義市,房地(土地+建物),嘉義市嘉義市忠孝路７９０之１９２號,78.0,住,,,1090409,土地1建物1車位0,全,三層,透天厝,住家用,鋼筋混凝土造,0830205,222.93,5,2,3,有,無,5800000,26017,,0.0,0,,RPOQMLOKNHPFFAI88EA,201.8,7.55,13.58,,
嘉義市,房地(土地+建物),嘉義市嘉義市蘭州四街７１號５樓２,7.68,住,,,1090330,土地1建物1車位0,五層,七層,套房(1房1廳1衛),住家用,鋼筋混凝土造,0820111,33.08,1,1,1,有,有,900000,27207,,0.0,0,,RPROMLSJOHPFFAI76EA,27.43,0.0,5.65,,
嘉義市,房地(土地+建物),嘉義市嘉義市國華街２８６號,1.79,商,,,1090319,土地1建物1車位0,一層,九層,辦公商業大樓,商業用,鋼筋混凝土造,0700725,11.03,0,0,0,無,無,250000,22665,,0.0,0,,RPQPMLTJOHPFFAI86EA,11.03,0.0,0.0,,
嘉義市,土地,鹿寮段806-1地號,89.32,住,,,1090427,土地5建物0車位0,,,其他,,,,0.0,0,0,0,有,無,800000,8957,,0.0,0,代書費 印花稅 登記規費等費用合計21963元整均由買方支付,RPPNMLSLNHPFFAI98CA,0.0,0.0,0.0,,
嘉義市,房地(土地+建物),嘉義市嘉義市興達路５９２巷１號八樓２,16.57,住,,,1090329,土地1建物1車位0,八層,十二層,住宅大樓(11層含以上有電梯),住家用,鋼筋混凝土造,0820618,135.66,4,2,2,有,有,4300000,31697,,0.0,0,本買賣含車位壹位。,RPRNMLNLNHPFFAI68CA,88.72,0.0,15.14,,
嘉義市,房地(土地+建物)+車位,嘉義市嘉義市合江街１３９號,90.0,住,,,1090410,土地1建物1車位1,全,四層,透天厝,住家用,見其他登記事項,1090227,204.36,4,2,4,有,無,13880000,67919,一樓平面,0.0,0,,RPVNMLTKNHPFFAI96CA,183.74,0.0,20.62,,
嘉義市,土地,竹圍子段14-42地號,391.0,住,,,1090224,土地1建物0車位0,,,其他,,,,0.0,0,0,0,有,無,29000000,74169,,0.0,0,,RPPOMLNLNHPFFAI58CA,0.0,0.0,0.0,,
嘉義市,土地,北湖段15-3地號,1530.0,農,,,1090408,土地3建物0車位0,,,其他,,,,0.0,0,0,0,有,無,3400000,2222,,0.0,0,,RPWNMLNKNHPFFAI09CA,0.0,0.0,0.0,,
嘉義市,土地,東川段635-23地號,64.0,住,,,1090430,土地2建物0車位0,,,其他,,,,0.0,0,0,0,有,無,1500000,23438,,0.0,0,,RPPPMLOKNHPFFAI68CA,0.0,0.0,0.0,,
嘉義市,房地(土地+建物)+車位,嘉義市嘉義市成仁街１７７號,37.32,商,,,1090430,土地1建物1車位2,一層，二層，騎樓,七層,華廈(10層含以下有電梯),住商用,鋼筋混凝土造,0850305,240.95999999999998,4,2,3,有,有,8000000,33201,升降機械,0.0,0,,RPRNMLPKNHPFFAI78CA,172.58,0.0,15.52,,
嘉義市,房地(土地+建物),嘉義市嘉義市興雅路32號四樓之3,12.32,住,,,1090411,土地1建物1車位0,四層,九層,華廈(10層含以下有電梯),住家用,鋼筋混凝土造,0820823,108.69,3,2,2,有,有,3100000,28521,,0.0,0,,RPPNMLTJOHPFFAI98CA,73.24,0.0,7.27,,
嘉義市,房地(土地+建物),嘉義市嘉義市重興里１０鄰博愛路一段４５２號、４５４號,138.0,住,,,1090320,土地2建物2車位0,一層，二層，騎樓,二層,店面(店鋪),住家用,木造,0540415,204.11,5,1,2,有,無,13000000,63691,,0.0,0,親友、員工或其他特殊關係間之交易。；,RPPOMLPKNHPFFAI68CA,204.11,0.0,0.0,,
嘉義市,房地(土地+建物),嘉義市嘉義市湖邊里７鄰博愛路一段３２０巷１１２號２樓,40.5,住,,,1090426,土地2建物1車位0,二層,四層,公寓(5樓含以下無電梯),住家用,鋼筋混凝土造,0710907,91.21,3,2,1,有,無,2500000,27409,,0.0,0,,RPPQMLOKNHPFFAI78CA,70.69,0.0,0.0,,
嘉義市,房地(土地+建物),嘉義市嘉義市蘭州四街７１號７樓３,6.87,住,,,1090505,土地1建物1車位0,七層,七層,套房(1房1廳1衛),住家用,鋼筋混凝土造,0820111,31.900000000000002,1,0,1,有,有,980000,30721,,0.0,0,,RPQQMLOKNHPFFAI88CA,23.67,0.0,0.0,,
嘉義市,房地(土地+建物)+車位,嘉義市嘉義市世賢路一段６４５號７樓之２,8.88,住,,,1090423,土地1建物1車位1,七層,十二層,住宅大樓(11層含以上有電梯),住家用,鋼筋混凝土造,0830718,101.68,2,2,1,有,有,2350000,23112,坡道機械,0.0,0,,RPRQMLOKNHPFFAI98CA,57.32,0.0,10.97,,
嘉義市,房地(土地+建物),嘉義市嘉義市民生南路５５巷６號,17.42,住,,,1090408,土地1建物1車位0,一層，二層，夾層,十二層,住宅大樓(11層含以上有電梯),見其他登記事項,鋼筋混凝土造,0860418,127.97,2,2,2,有,有,4700000,36727,,0.0,0,含機械式車位壹位,RPSNMLKLNHPFFAI48CA,88.25,3.54,3.54,,
嘉義市,房地(土地+建物),嘉義市嘉義市忠孝路７９０－５５號４樓２３,5.6,住,,,1090331,土地1建物1車位0,四層,十一層,套房(1房1廳1衛),住家用,鋼筋混凝土造,0841004,35.58,0,0,0,無,有,1430000,40191,,0.0,0,,RPVOMLOKNHPFFAI56CA,25.33,0.0,2.05,,
嘉義市,房地(土地+建物)+車位,嘉義市嘉義市博東路25號,22.67,住,,,1090410,土地2建物1車位1,一層，二層，三層,十二層,住宅大樓(11層含以上有電梯),住商用,鋼筋混凝土造,0830525,163.18,4,2,3,有,有,6050000,37076,坡道機械,0.0,0,,RPROMLNLNHPFFAI78CA,129.65,3.68,7.36,,
嘉義市,房地(土地+建物)+車位,嘉義市嘉義市泰山一街43號4樓2,22.85,住,,,1090427,土地1建物1車位1,四層,十四層,住宅大樓(11層含以上有電梯),住家用,鋼筋混凝土造,0831223,191.47,4,2,2,有,有,4880000,25487,坡道機械,0.0,0,,RPUNMLQLNHPFFAI66CA,66.12,78.67,9.36,,
嘉義市,房地(土地+建物),嘉義市嘉義市福全街６０號六樓之７,21.89,住,,,1090501,土地3建物1車位0,六層,七層,華廈(10層含以下有電梯),住家用,鋼筋混凝土造,0820510,137.91,3,2,2,有,有,4700000,34080,,0.0,0,本件含車位壹位地下壹層機械式上層,RPOOMLTLNHPFFAI09CA,81.43,0.0,9.75,,
嘉義市,房地(土地+建物)+車位,嘉義市嘉義市玉山路２５１巷３７弄７號地下室及玉山路251巷37弄23號五樓之2,52.0,住,,,1090426,土地1建物1車位1,五層,五層,公寓(5樓含以下無電梯),住家用,鋼筋混凝土造,0811111,181.34,3,2,2,有,有,4160000,22940,坡道平面,0.0,0,,RPQNMLKMNHPFFAI38CA,131.21,2.76,14.53,,
嘉義市,房地(土地+建物),嘉義市嘉義市友愛路４９４號九樓之２及友愛路486號,16.08,住,,,1090421,土地1建物1車位0,九層，夾層,十二層,住宅大樓(11層含以上有電梯),住家用,鋼筋混凝土造,0881129,144.0,4,2,2,有,有,4520000,31389,,0.0,0,,RPSNMLKMNHPFFAI58CA,94.9,0.0,9.58,,
嘉義市,房地(土地+建物)+車位,嘉義市嘉義市民族路５４６號二樓,267.0,商,,,1090427,土地1建物6車位4,四層,五層,華廈(10層含以下有電梯),見其他登記事項,見其他登記事項,1040810,976.99,0,0,0,無,無,72098400,73796,升降機械,0.0,0,土地及建物分次登記案件。前案土地登記收件字號：；,RPROMLLKRHPFFAI09EA,684.78,0.0,63.65,,
嘉義市,房地(土地+建物),嘉義市嘉義市宣信街１７７巷３號,63.0,住,,,1090504,土地1建物1車位0,全,二層,透天厝,住家用,見使用執照,0610203,80.85,3,2,2,有,無,5500000,68027,,0.0,0,,RPSOMLTLNHPFFAI86CA,80.85,0.0,0.0,,
嘉義市,房地(土地+建物),嘉義市嘉義市福全街７號,105.64,住,,,1090421,土地2建物1車位0,全,四層,透天厝,住家用,見其他登記事項,1060629,209.65,5,2,4,有,無,15000000,71548,,0.0,0,,RPTOMLTLNHPFFAI96CA,186.0,0.0,23.65,,
嘉義市,房地(土地+建物),嘉義市嘉義市世賢路四段３５０巷２１弄２４號五樓,26.8,住,,,1090412,土地1建物1車位0,五層,十層,華廈(10層含以下有電梯),住家用,鋼筋混凝土造,0830602,125.30000000000001,3,2,2,有,有,3200000,25539,,0.0,0,,RPVOMLTLNHPFFAI17CA,87.88,0.0,11.24,,
嘉義市,房地(土地+建物),嘉義市嘉義市興達路５０８號四樓２,13.78,住,,,1090407,土地1建物1車位0,四層,十六層,住宅大樓(11層含以上有電梯),住家用,鋼筋混凝土造,0831125,152.52,3,2,2,有,有,5500000,36061,,0.0,0,,RPWOMLTLNHPFFAI27CA,84.45,24.26,20.82,,
嘉義市,房地(土地+建物),嘉義市嘉義市仁愛路１２號５樓７,8.41,住,,,1090424,土地1建物1車位0,五層,七層,套房(1房1廳1衛),住家用,鋼筋混凝土造,0800823,46.8,1,1,1,有,有,2000000,42735,,0.0,0,,RPUOMLSLNHPFFAI96CA,39.01,0.0,2.4,,
嘉義市,房地(土地+建物),嘉義市嘉義市博東路１５９號１３樓１,14.59,住,,,1090422,土地1建物1車位0,十三層,二十二層,住宅大樓(11層含以上有電梯),住家用,鋼筋混凝土造,0870319,116.61,3,2,2,有,有,3880000,33273,,0.0,0,,RPUOMLLLNHPFFAI88CA,73.3,0.0,8.15,,
嘉義市,房地(土地+建物),嘉義市嘉義市民生南路１１３號,58.8,住,,,1090430,土地2建物1車位0,全,二層,透天厝,住家用,見其他登記事項,0500815,27.86,4,2,2,有,無,3200000,114860,,0.0,0,,RPVNMLMLNHPFFAI98CA,27.86,0.0,0.0,,
嘉義市,房地(土地+建物),嘉義市嘉義市北社尾路３９７巷３７之２號,109.0,住,,,1090415,土地3建物1車位0,全,三層,透天厝,見其他登記事項,見其他登記事項,1081226,184.86,3,2,3,有,無,8500000,45981,,0.0,0,,RPPNMLPKNHPFFAI58CA,170.25,0.0,14.61,,
嘉義市,房地(土地+建物),嘉義市嘉義市大溪路４８６號,103.73,住,,,1090423,土地2建物1車位0,全,三層,透天厝,住家用,見其他登記事項,1081218,163.41,4,3,4,有,無,8800000,53852,,0.0,0,,RPWNMLQKNHPFFAI76CA,144.95,0.0,18.46,,
嘉義市,房地(土地+建物),嘉義市嘉義市北社尾路３９７巷３７之９號,112.0,住,,,1090415,土地3建物1車位0,全,三層,透天厝,見其他登記事項,見其他登記事項,1081226,191.66,3,2,3,有,無,8880000,46332,,0.0,0,,RPRNMLSKNHPFFAI09CA,177.06,0.0,14.6,,
嘉義市,房地(土地+建物)+車位,嘉義市嘉義市新民路７６２號１２樓４及新民路762號地下層1號,29.59,住,,,1090319,土地1建物2車位2,十二層,十五層,住宅大樓(11層含以上有電梯),住家用,鋼筋混凝土造,0831220,268.98,4,2,2,有,有,9500000,35319,坡道機械,0.0,0,,RPOPMLTJOHPFFAI09CA,187.37,0.0,20.42,,
嘉義市,房地(土地+建物)+車位,嘉義市嘉義市德明路73號3樓1,23.27,住,,,1090408,土地1建物1車位2,三層,十九層,住宅大樓(11層含以上有電梯),住家用,鋼筋混凝土造,0840816,255.12,3,2,2,有,有,8830000,34611,坡道平面,0.0,0,,RPSNMLTJOHPFFAI66CA,120.57,41.91,15.02,,
嘉義市,房地(土地+建物),嘉義市嘉義市安和街22218號11樓1,26.1,住,,,1090409,土地1建物1車位0,十一層，十二層,十二層,住宅大樓(11層含以上有電梯),住家用,鋼筋混凝土造,0850214,190.49,5,2,3,有,有,6900000,36222,,0.0,0,,RPVNMLPKNHPFFAI66DA,118.68,4.59,5.2,,
嘉義市,房地(土地+建物),嘉義市嘉義市彌陀路１９４號１０樓２,19.28,住,,,1090429,土地1建物1車位0,十層,十二層,住宅大樓(11層含以上有電梯),住家用,鋼筋混凝土造,0820908,128.7,3,2,2,有,有,4080000,31702,,0.0,0,,RPQOMLLLNHPFFAI68EA,95.4,0.0,13.71,,
嘉義市,土地,劉厝段劉厝小段44地號,311.0,農,,,1090424,土地1建物0車位0,,,其他,,,,0.0,0,0,0,有,無,5492260,17660,,0.0,0,向政府機關承購之案件。；,RPTNMLTKNHPFFAI96EA,0.0,0.0,0.0,,
嘉義市,房地(土地+建物),嘉義市嘉義市博東路１５５號９樓２,15.4,住,,,1090423,土地1建物1車位0,九層,二十二層,住宅大樓(11層含以上有電梯),住家用,鋼筋混凝土造,0870319,124.73,3,2,2,有,有,3660000,29343,,0.0,0,,RPPNMLMKOHPFFAI38CA,77.04,0.0,12.05,,
嘉義市,房地(土地+建物),嘉義市嘉義市遼寧一街１０之２號,116.0,住,,,1090416,土地1建物1車位0,全,三層,透天厝,見其他登記事項,鋼筋混凝土造,0951012,190.57,3,3,3,有,無,10500000,55098,,0.0,0,,RPOOMLSKNHPFFAI88CA,180.69,0.0,9.88,,
嘉義市,土地,北社尾段466-14地號,24.86,都市：其他:道路用地,,,1090429,土地1建物0車位0,,,其他,,,,0.0,0,0,0,有,無,35000,1408,,0.0,0,包含公共設施保留地之交易。；,RPVNMLLLNHPFFAI88CA,0.0,0.0,0.0,,
嘉義市,房地(土地+建物),嘉義市嘉義市義教街８７９號三樓１,36.44,住,,,1090414,土地2建物1車位0,三層,五層,公寓(5樓含以下無電梯),住家用,鋼筋混凝土造,0720324,103.44,3,2,2,有,無,1900000,18368,,0.0,0,,RPSOMLLLNHPFFAI68CA,89.96,0.0,0.0,,
嘉義市,房地(土地+建物),嘉義市嘉義市武昌街５號,76.0,住,,,1090302,土地1建物1車位0,全,二層,透天厝,住商用,鋼筋混凝土造,0720112,81.46,4,2,3,有,無,5600000,68745,,0.0,0,親友、員工或其他特殊關係間之交易。；,RPWNMLQLNHPFFAI86CA,78.32,3.14,0.0,,
嘉義市,房地(土地+建物),嘉義市嘉義市世賢路四段３５０巷２１弄６５號二樓之２,15.02,住,,,1090415,土地1建物1車位0,二層,六層,華廈(10層含以下有電梯),住家用,鋼筋混凝土造,0810903,70.04,2,2,1,有,有,1950000,27841,,0.0,0,,RPSNMLSLNHPFFAI66CA,44.27,1.47,3.29,,
嘉義市,房地(土地+建物),嘉義市嘉義市劉富街140號,218.07,住,,,1090422,土地4建物1車位0,全,二層,透天厝,住家用,鋼造,0840524,84.4,2,2,2,有,無,8300000,98341,,0.0,0,,RPTOMLOJOHPFFAI98CA,84.4,0.0,0.0,,
嘉義市,房地(土地+建物),嘉義市嘉義市健康十五街18號,94.83,住,,,1090424,土地1建物1車位0,全,三層,透天厝,見其他登記事項,見其他登記事項,1090317,197.84,4,1,3,有,無,10280000,51961,,0.0,0,交易總價另加新台幣18萬元正施作車庫圍牆工程費。,RPUOMLNJOHPFFAI98CA,182.6,0.0,15.24,,
嘉義市,房地(土地+建物),嘉義市嘉義市公園街９７號,145.0,住,,,1090422,土地1建物1車位0,全,二層,透天厝,住家用,鋼筋混凝土加強磚造,0641020,165.0,4,2,2,有,無,19000000,115152,,0.0,0,含增建或未登記建物。；,RPVNMLNJOHPFFAI98CA,156.11,8.89,0.0,,
嘉義市,房地(土地+建物)+車位,嘉義市嘉義市林森東路７２２之２４號七樓之４,49.42,住,,,1090405,土地1建物1車位1,七層,十三層,住宅大樓(11層含以上有電梯),住家用,鋼筋混凝土造,0920317,200.18,3,2,2,有,有,6600000,32970,坡道平面,0.0,0,,RPSNMLRLNHPFFAI56CA,116.64,0.0,12.03,,
嘉義市,房地(土地+建物),嘉義市嘉義市友愛路３１７巷１１弄６６號,77.0,住,,,1090409,土地1建物1車位0,全,二層,透天厝,住家用,木造,0621021,77.79,3,2,2,有,無,3000000,38565,,0.0,0,親友、員工或其他特殊關係間之交易。；,RPQOMLRLNHPFFAI09CA,77.79,0.0,0.0,,
嘉義市,房地(土地+建物),嘉義市嘉義市彌陀路４０號二樓之１,5.26,住,,,1090508,土地2建物1車位0,二層,四層,套房(1房1廳1衛),見其他登記事項,鋼筋混凝土造,0970303,14.02,1,1,1,有,有,720000,51355,,0.0,0,,RPTOMLSLNHPFFAI86CA,6.44,0.0,1.92,,
嘉義市,房地(土地+建物),嘉義市嘉義市吳鳳南路６２１巷２２號,74.0,住,,,1090418,土地1建物1車位0,全,二層,透天厝,住家用,鋼筋混凝土加強磚造,0660305,89.2,4,2,2,有,無,3850000,43161,,0.0,0,,RPSNMLTKNHPFFAI66CA,89.2,0.0,0.0,,
嘉義市,房地(土地+建物),嘉義市嘉義市彌陀路272巷47號,168.71,住,,,1090508,土地3建物1車位0,全,五層,透天厝,見其他登記事項,見其他登記事項,1050817,517.77,4,3,6,有,有,22800000,44035,,0.0,0,,RPWNMLPKOHPFFAI76CA,449.31,0.0,22.54,,
嘉義市,土地,鹿寮段769地號,12.76,住,,,1090301,土地5建物0車位0,,,其他,,,,0.0,0,0,0,有,無,71780,5625,,0.0,0,土地增值稅10392元106107108地價稅1046印花稅134元書狀費5600上述買賣費用由權利人負擔,RPPNMLPLNHPFFAI88EA,0.0,0.0,0.0,,
嘉義市,土地,鹿寮段769地號,12.76,住,,,1090301,土地5建物0車位0,,,其他,,,,0.0,0,0,0,有,無,71780,5625,,0.0,0,土地增值稅10392元106107108地價稅1046印花稅134元書狀費5600上述買賣費用由權利人負擔,RPQNMLPLNHPFFAI98EA,0.0,0.0,0.0,,
嘉義市,土地,鹿寮段769地號,12.76,住,,,1090301,土地5建物0車位0,,,其他,,,,0.0,0,0,0,有,無,71780,5625,,0.0,0,土地增值稅10392元106107108地價稅1046印花稅134元書狀費5600上述買賣費用由權利人負擔,RPRNMLPLNHPFFAI09EA,0.0,0.0,0.0,,
嘉義市,土地,鹿寮段769地號,12.76,住,,,1090301,土地5建物0車位0,,,其他,,,,0.0,0,0,0,有,無,71780,5625,,0.0,0,土地增值稅10392元106107108地價稅1046印花稅134元書狀費5600上述買賣費用由權利人負擔,RPSNMLPLNHPFFAI56EA,0.0,0.0,0.0,,
嘉義市,土地,鹿寮段769地號,12.76,住,,,1090301,土地5建物0車位0,,,其他,,,,0.0,0,0,0,有,無,71780,5625,,0.0,0,土地增值稅10392元106107108地價稅1046印花稅134元書狀費5600上述買賣費用由權利人負擔,RPTNMLPLNHPFFAI66EA,0.0,0.0,0.0,,
嘉義市,土地,鹿寮段769地號,12.76,住,,,1090305,土地5建物0車位0,,,其他,,,,0.0,0,0,0,有,無,71780,5625,,0.0,0,土地增值稅10392元106107108地價稅1046印花稅134元書狀費5600上述買賣費用由權利人負擔,RPUNMLPLNHPFFAI76EA,0.0,0.0,0.0,,
嘉義市,土地,鹿寮段769地號,17.86,住,,,1090301,土地5建物0車位0,,,其他,,,,0.0,0,0,0,有,無,100492,5627,,0.0,0,土地增值稅12692元106107108地價稅1465印花稅188元書狀費2800上述買賣費用由權利人負擔,RPVNMLPLNHPFFAI86EA,0.0,0.0,0.0,,
嘉義市,土地,鹿寮段769地號,14.89,住,,,1090310,土地5建物0車位0,,,其他,,,,0.0,0,0,0,有,無,83678,5620,,0.0,0,土地增值稅12124元106107108地價稅1221印花稅157元書狀費2800上述買賣費用由權利人負擔,RPWNMLPLNHPFFAI96EA,0.0,0.0,0.0,,
嘉義市,土地,鹿寮段769地號,14.89,住,,,1090325,土地5建物0車位0,,,其他,,,,0.0,0,0,0,有,無,83678,5620,,0.0,0,土地增值稅12124元106107108地價稅1221印花稅157元書狀費2800上述買賣費用由權利人負擔,RPXNMLPLNHPFFAI07EA,0.0,0.0,0.0,,
嘉義市,房地(土地+建物)+車位,嘉義市嘉義市八德路３６６號６樓１,23.3,住,,,1090505,土地1建物1車位1,六層,八層,華廈(10層含以下有電梯),住家用,鋼筋混凝土造,0821108,132.72,3,1,2,有,有,5200000,39180,升降機械,0.0,0,,RPPNMLKLNHPFFAI38EA,81.7,0.0,14.08,,
嘉義市,土地,檜段五小段16-1地號,12.67,商,,,1090502,土地1建物0車位0,,,其他,,,,0.0,0,0,0,有,無,2500000,197316,,0.0,0,含增建或未登記建物。；含未保存登記建物,RPUNMLKLNHPFFAI88EA,0.0,0.0,0.0,,
