信義區,建物,臺北市信義區中坡南路22巷7號3樓之1,0.0,住,,,1090227,土地0建物1車位0,三層,7,華廈(10層含以下有電梯),住家用,鋼筋混凝土造,1021107,66.13,2,1,1,有,無,有,35000,529,,0.0,0,,RPROMLOJLHPFFDA18CC
南港區,建物,臺北市南港區忠孝東路六段４９１號三樓,0.0,工,,,1090229,土地0建物0車位0,三層,4,套房(1房1廳1衛),工業用,鋼筋混凝土造,,33.54,1,0,1,有,無,有,12000,358,,0.0,0,此為分租套房，第3層共分成17間，一間平均面積約為33.54平方公尺,RPWOMLOJLHPFFDA68CC
南港區,建物,臺北市南港區園區街48號11樓,0.0,住,,,1090225,土地0建物1車位1,十一層,12,住宅大樓(11層含以上有電梯),住家用,鋼筋混凝土造,1000414,187.89,4,2,2,有,無,有,50000,266,坡道平面,33.87,0,,RPXOMLOJLHPFFDA78CC
北投區,建物,臺北市北投區大業路７４３號,0.0,商,,,1090227,土地0建物0車位0,二層,4,套房(1房1廳1衛),住商用,加強磚造,0500720,30.07,1,0,1,有,無,有,11800,392,,0.0,0,此為分租套房，第2層共分成8間，一間平均面積約為30.07平方公尺,RPTNMLOJLHPFFEA38CC
北投區,建物,臺北市北投區樹林路１０之１號,0.0,住,,,1090218,土地0建物1車位0,一層,5,公寓(5樓含以下無電梯),住家用,鋼筋混凝土造,0731003,125.47,3,2,2,有,無,無,20000,159,,0.0,0,,RPQOMLOJLHPFFEA18CC
士林區,建物,臺北市士林區天母東路36-2號9樓,0.0,商,,,1090217,土地0建物1車位0,九層,12,住宅大樓(11層含以上有電梯),住家用,鋼筋混凝土造,0751017,174.62,4,2,2,有,有,有,67000,384,,0.0,0,,RPVOMLOJLHPFFEA68CC
士林區,建物,臺北市士林區天母東路26號11樓,0.0,商,,,1090227,土地0建物1車位0,十一層,12,住宅大樓(11層含以上有電梯),住家用,鋼筋混凝土造,0740515,135.64,3,2,2,有,有,有,63000,464,,0.0,0,續租。；,RPWOMLOJLHPFFEA78CC
文山區,建物,臺北市文山區景華街82巷2弄5號四樓,0.0,住,,,1090229,土地0建物0車位0,四層,4,套房(1房1廳1衛),住家用,鋼筋混凝土造,,20.61,1,0,1,有,無,有,9000,437,,0.0,0,此為分租套房，第4層共分成5間，一間平均面積約為20.61平方公尺,RPTNMLOJLHPFFAA97CC
中正區,建物,臺北市中正區南昌路二段89號13樓之2,0.0,商,,,1090226,土地0建物1車位0,十三層,14,住宅大樓(11層含以上有電梯),見其他登記事項,見其他登記事項,1080124,55.010000000000005,2,1,2,有,無,有,40000,727,,0.0,0,,RPUNMLOJLHPFFAA08CC
中正區,建物,臺北市中正區金門街１之１０號,0.0,商,,,1090218,土地0建物1車位0,一層,4,公寓(5樓含以下無電梯),,加強磚造,,70.47,3,2,1,有,無,有,23000,326,,0.0,0,房屋用途做辦公室及住家使用,RPWNMLOJLHPFFAA28CC
中正區,建物,臺北市中正區中華路二段７５巷６號五樓,0.0,住,,,1090226,土地0建物0車位0,五層,5,套房(1房1廳1衛),住家用,鋼筋混凝土造,0731205,39.31,1,0,1,有,無,有,13300,338,,0.0,0,此為分租套房，第5層共分成3間，一間平均面積約為39.31平方公尺,RPSOMLOJLHPFFAA97CC
中正區,建物,臺北市中正區和平西路一段１１號八樓,0.0,商,,,1090226,土地0建物0車位0,八層,11,套房(1房1廳1衛),商業用,鋼筋混凝土造,,44.730000000000004,1,0,1,有,無,有,13500,302,,0.0,0,此為分租套房，第8層共分成20間，一間平均面積約為44.73平方公尺,RPVOMLOJLHPFFAA28CC
中正區,建物,臺北市中正區和平西路一段１１號八樓,0.0,商,,,1090225,土地0建物0車位0,八層,11,套房(1房1廳1衛),商業用,鋼筋混凝土造,,44.6,1,0,1,有,無,有,14000,314,,0.0,0,,RPWOMLOJLHPFFAA38CC
內湖區,建物,臺北市內湖區民權東路六段160號13樓之1,0.0,商,,,1090217,土地0建物1車位0,十四層,14,辦公商業大樓,商業用,鋼筋混凝土造,0810629,171.24,2,0,2,有,有,無,50000,292,,0.0,0,分租,RPXSMLOJLHPFFCA56DC
大安區,建物,臺北市大安區延吉街238之1號2樓,0.0,住,,,1090225,土地0建物1車位0,二層,7,華廈(10層含以下有電梯),住家用,鋼筋混凝土造,,78.08,2,1,2,有,無,有,40000,512,,0.0,0,,RPTNMLOJLHPFFFA48CC
松山區,建物,臺北市松山區光復北路82號6樓,0.0,商,,,1090218,土地0建物1車位0,六層,11,辦公商業大樓,商業用,鋼筋混凝土造,0810410,277.98,5,0,2,有,有,有,94500,340,,0.0,0,,RPVPMLPJLHPFFDA88DC
大安區,房地(土地+建物),臺北市大安區新生南路3段16之1號、16之2號、16之3號,199.0,住,,,1090303,土地1建物1車位0,全,3,透天厝,,加強磚造,,286.26,0,0,0,無,有,無,70000,245,,0.0,0,續租。；,RPQNMLPJLHPFFFA38DC
中正區,建物,臺北市中正區和平西路一段11號八樓,0.0,商,,,1090302,土地0建物0車位0,八層,11,套房(1房1廳1衛),商業用,鋼筋混凝土造,,44.730000000000004,1,0,1,有,無,有,14500,324,,0.0,0,此為分租套房，第8層共分成20間，一間平均面積約為44.73平方公尺,RPSOMLPJLHPFFAA08CC
北投區,建物,臺北市北投區振興街１號五樓之１２,0.0,其他,,,1090218,土地0建物1車位0,五層,8,辦公商業大樓,商業用,鋼筋混凝土造,0860203,40.99,1,0,1,有,有,有,17000,415,,0.0,0,,RPTNMLPJLHPFFEA48CC
北投區,建物,臺北市北投區石牌路二段315巷28弄16號六樓,0.0,住,,,1090210,土地0建物1車位0,二層,7,套房(1房1廳1衛),住家用,鋼筋混凝土造,0971009,42.120000000000005,1,1,1,有,有,有,19000,451,,0.0,0,,RPOOMLPJLHPFFEA08CC
北投區,建物,臺北市北投區中和街４９５號四樓,0.0,住,,,1090229,土地0建物1車位0,四層,5,公寓(5樓含以下無電梯),住家用,鋼筋混凝土造,0711227,91.98,2,1,1,有,無,有,15000,163,,0.0,0,,RPROMLPJLHPFFEA38CC
北投區,建物,臺北市北投區大業路743號,0.0,商,,,1090229,土地0建物0車位0,全,4,透天厝,住商用,加強磚造,0500720,30.07,2,1,1,有,無,有,15000,499,,0.0,0,第3層共分成8間，一間平均面積約為30.07平方公尺,RPVOMLPJLHPFFEA78CC
南港區,房地(土地+建物),臺北市南港區新民街62號2樓,25.0,住,,,1090220,土地1建物1車位0,二層,4,公寓(5樓含以下無電梯),見使用執照,鋼筋混凝土造,0670301,89.44,3,2,1,有,無,有,28000,313,,0.0,0,,RPPNMLPJLHPFFDA97CC
南港區,房地(土地+建物),臺北市南港區研究院路一段151巷8號4樓,21.7,住,,,1090225,土地2建物1車位0,四層,7,華廈(10層含以下有電梯),住家用,鋼筋混凝土造,,89.86,4,2,2,有,無,有,38000,423,,0.0,0,,RPQNMLPJLHPFFDA08CC
信義區,建物,臺北市信義區忠孝東路五段510號9樓之3,0.0,住,,,1090302,土地0建物1車位0,九層,27,住宅大樓(11層含以上有電梯),商業用,鋼骨混凝土造,0820813,197.25,0,0,0,無,無,有,85000,431,,0.0,0,,RPUNMLPJLHPFFDA48CC
信義區,建物,臺北市信義區忠孝東路5段800號9樓之11,0.0,住,,,1090220,土地0建物1車位0,九層,13,住宅大樓(11層含以上有電梯),見其他登記事項,鋼筋混凝土造,0960103,50.54,0,0,0,無,有,無,19800,392,,0.0,0,,RPVNMLPJLHPFFDA58CC
南港區,建物,臺北市南港區忠孝東路六段481號二樓,0.0,工,,,1090303,土地0建物0車位0,二層,4,套房(1房1廳1衛),工業用,鋼筋混凝土造,,30.66,1,0,1,有,無,有,12500,408,,0.0,0,此為分租套房，第2層共分成32間，一間平均面積約為30.66平方公尺,RPOPMLPJLHPFFDA08CC
中正區,房地(土地+建物)+車位,臺北市中正區仁愛路二段88號5樓,0.0,住,,,1090226,土地2建物1車位2,五層,14,住宅大樓(11層含以上有電梯),住家用,鋼筋混凝土造,0970227,605.97,4,3,4,有,有,有,250000,413,坡道平面,88.36,0,,RPTNMLPJLHPFFBA18CC
萬華區,建物,臺北市萬華區雅江街62之1號四樓,0.0,住,,,1090304,土地0建物0車位0,四層,4,套房(1房1廳1衛),住家用,鋼筋混凝土造,0740404,23.63,1,0,1,有,無,有,10000,423,,0.0,0,此為分租套房，第4層共分成2間，一間平均面積約為23.63平方公尺,RPXNMLPJLHPFFBA58CC
中山區,建物,臺北市中山區明水路３９７巷１８弄１６號９樓,0.0,住,,,1090215,土地0建物1車位2,九層,15,住宅大樓(11層含以上有電梯),住家用,鋼筋混凝土造,0960919,274.0,4,2,2,有,有,有,115000,420,坡道平面,64.02,0,,RPVNMLPJLHPFFCA48CC
中山區,建物,臺北市中山區長安東路2段142號六樓之1,0.0,商,,,1090227,土地0建物1車位0,六層,12,住宅大樓(11層含以上有電梯),住商用,鋼筋混凝土造,0670121,72.15,1,1,1,有,有,無,35000,485,,0.0,0,,RPWNMLPJLHPFFCA58CC
中山區,建物,臺北市中山區民生東路二段１４７巷６弄６號,0.0,住,,,1090218,土地0建物1車位0,一層,3,店面(店鋪),,加強磚造,,77.43,0,0,0,無,無,有,27000,349,,0.0,0,,RPOOMLPJLHPFFCA87CC
中山區,建物,臺北市中山區松江路328號5樓之6,0.0,商,,,1090210,土地0建物1車位0,五層,12,住宅大樓(11層含以上有電梯),住家用,鋼筋混凝土造,0661208,110.33,0,0,0,無,有,無,45408,412,,0.0,0,,RPWOMLPJLHPFFCA68CC
內湖區,房地(土地+建物)+車位,臺北市內湖區康樂街204-3號,24.0,住,,,1090304,土地1建物1車位2,一層,11,住宅大樓(11層含以上有電梯),商業用,鋼筋混凝土造,0970331,115.64,3,2,2,有,有,無,40000,346,坡道平面,42.9,0,,RPOPMLPJLHPFFCA97CC
中山區,建物,臺北市中山區建國北路二段87號2樓,0.0,其他,,,1090221,土地0建物1車位0,二層,13,住宅大樓(11層含以上有電梯),見其他登記事項,鋼筋混凝土造,0711118,107.27,0,0,0,無,有,無,45000,420,,0.0,0,,RPPPMLPJLHPFFCA08CC
中山區,建物,臺北市中山區南京東路2段165之5號,0.0,商,,,1090214,土地0建物1車位0,五層,8,辦公商業大樓,商業用,鋼筋混凝土造,,175.2,0,0,0,無,無,無,78750,449,,0.0,0,承租5樓北側部分B室約53坪。租金含5%營業稅。,RPQPMLPJLHPFFCA18CC
內湖區,建物,臺北市內湖區內湖路一段285巷65弄25號,0.0,住,,,1090205,土地0建物1車位0,一層,5,店面(店鋪),見使用執照,鋼筋混凝土造,0701214,89.02,0,0,0,無,無,無,38000,427,,0.0,0,,RPRPMLPJLHPFFCA28CC
中山區,建物,臺北市中山區農安街8號7樓之9,0.0,商,,,1090302,土地0建物1車位0,七層,14,住宅大樓(11層含以上有電梯),商業用,鋼筋混凝土造,0980622,51.21,1,1,1,有,有,有,36000,703,,0.0,0,短租,RPUPMLPJLHPFFCA58CC
中山區,建物,臺北市中山區吉林路135號三樓,0.0,商,,,1090301,土地0建物0車位0,三層,3,套房(1房1廳1衛),住家用,加強磚造,,16.28,1,0,1,有,無,有,9800,602,,0.0,0,此為分租套房，第3層共分成6間，一間平均面積約為16.28平方公尺,RPVPMLPJLHPFFCA68CC
中山區,建物,臺北市中山區農安街22之2號四樓,0.0,商,,,1090301,土地0建物0車位0,四層,4,套房(1房1廳1衛),住家用,鋼筋混凝土造,0621012,30.39,1,0,1,有,無,有,13000,428,,0.0,0,此為分租套房，第4層共分成3間，一間平均面積約為30.39平方公尺,RPWPMLPJLHPFFCA78CC
中山區,建物,臺北市中山區八德路2段229號三樓,0.0,商,,,1090301,土地0建物0車位0,三層,5,套房(1房1廳1衛),住家用,鋼筋混凝土造,0610720,26.17,1,0,1,有,無,有,11500,439,,0.0,0,此為分租套房，第3層共分成4間，一間平均面積約為26.17平方公尺,RPPQMLPJLHPFFCA18CC
中山區,建物,臺北市中山區民生西路3巷2之2號4樓之1,0.0,住,,,1090204,土地0建物1車位0,四層,5,華廈(10層含以下有電梯),住家用,鋼筋混凝土造,0801102,47.5,1,1,1,有,無,有,21000,442,,0.0,0,,RPRQMLPJLHPFFCA38CC
中山區,建物,臺北市中山區林森北路259巷9號3樓之8,0.0,商,,,1090222,土地0建物1車位0,六層,7,華廈(10層含以下有電梯),住家用,鋼筋混凝土造,0730922,45.37,0,0,0,無,無,有,16000,353,,0.0,0,,RPXQMLPJLHPFFCA98CC
中山區,建物,臺北市中山區南京東路2段7之1號,0.0,商,,,1090301,土地0建物0車位0,四層,8,套房(1房1廳1衛),住商用,鋼筋混凝土造,0580616,18.93,1,0,1,有,無,有,10800,571,,0.0,0,此為分租套房，第4層共分成8間，一間平均面積約為18.93平方公尺,RPORMLPJLHPFFCA18CC
中山區,建物,臺北市中山區新生北路二段74號12樓之3,0.0,商,,,1090223,土地0建物1車位0,十二層,12,住宅大樓(11層含以上有電梯),住家用,鋼筋混凝土造,0610402,33.76,0,0,0,無,無,有,19250,570,,0.0,0,,RPPRMLPJLHPFFCA28CC
中山區,建物,臺北市中山區林森北路259巷9號6樓之9,0.0,商,,,1090204,土地0建物1車位0,六層,7,華廈(10層含以下有電梯),住家用,鋼筋混凝土造,0730922,45.370000000000005,0,0,0,無,無,有,21000,463,,0.0,0,,RPQRMLPJLHPFFCA38CC
內湖區,建物,臺北市內湖區瑞光路358巷30弄15號3樓,0.0,工,,,1090210,土地0建物1車位1,三層,8,廠辦,見其他登記事項,鋼筋混凝土造,1040828,411.2,0,0,0,無,有,無,105000,255,坡道平面,36.01,0,,RPOSMLPJLHPFFCA28CC
中山區,建物,臺北市中山區植福路308號7樓之5,0.0,商,,,1090227,土地0建物1車位0,七層,10,辦公商業大樓,見其他登記事項,見其他登記事項,1041027,192.09,0,0,0,無,有,無,120000,625,,0.0,0,,RPPSMLPJLHPFFCA38CC
中山區,建物,臺北市中山區吉林路１３５號二樓,0.0,商,,,1090226,土地0建物0車位0,二層,3,套房(1房1廳1衛),住家用,加強磚造,,19.53,1,0,1,有,無,有,8800,451,,0.0,0,此為分租套房，第2層共分成5間，一間平均面積約為19.53平方公尺,RPQSMLPJLHPFFCA48CC
中山區,建物,臺北市中山區南京東路一段132巷15號7樓,0.0,商,,,1090301,土地0建物0車位0,七層,7,套房(1房1廳1衛),商業用,鋼筋混凝土造,0681226,21.89,1,0,1,有,無,有,12800,585,,0.0,0,此為分租套房，第7層共分成8間，一間平均面積約為21.89平方公尺,RPRSMLPJLHPFFCA58CC
中山區,建物,臺北市中山區新生北路二段１０８號五樓之２２,0.0,商,,,1090228,土地0建物1車位0,五層,14,住宅大樓(11層含以上有電梯),商業用,鋼筋混凝土造,0760305,31.89,1,0,1,有,無,有,14000,439,,0.0,0,,RPTSMLPJLHPFFCA78CC
中山區,建物,臺北市中山區長春路57號11樓之2,0.0,商,,,1090302,土地0建物1車位0,十一層,12,住宅大樓(11層含以上有電梯),住家用,鋼筋混凝土造,0651224,38.81,1,1,1,有,有,有,15000,386,,0.0,0,,RPPOMLQJLHPFFCA08CC
中山區,建物,臺北市中山區新生北路一段27號,0.0,住,,,1090301,土地0建物0車位0,三層,4,套房(1房1廳1衛),,加強磚造,,23.0,1,0,1,有,無,有,15000,652,,0.0,0,此為分租套房，第3層共分成3間，一間平均面積約為23平方公尺,RPSOMLQJLHPFFCA38CC
中山區,建物,臺北市中山區中山北路二段27巷5號8樓,0.0,商,,,1090303,土地0建物1車位0,八層,12,住宅大樓(11層含以上有電梯),見其他登記事項,鋼筋混凝土造,1060706,159.39,2,1,2,有,無,有,124856,783,,0.0,0,,RPPPMLQJLHPFFCA18CC
中山區,建物,臺北市中山區長安東路二段114號,0.0,商,,,1090302,土地0建物1車位0,一層,10,店面(店鋪),商業用,鋼筋混凝土造,0791226,86.14,0,0,0,無,無,無,70000,813,,0.0,0,,RPTPMLQJLHPFFCA58CC
中山區,建物,臺北市中山區新生北路二段66號3樓之13,0.0,商,,,1090218,土地0建物1車位0,三層,12,套房(1房1廳1衛),商業用,鋼筋混凝土造,0690721,27.869999999999997,1,1,1,有,有,有,13800,495,,0.0,0,,RPXPMLQJLHPFFCA98CC
中山區,建物,臺北市中山區林森北路101號2樓,0.0,商,,,1090218,土地0建物0車位0,二層,12,辦公商業大樓,商業用,鋼筋混凝土造,0700812,44.56,4,1,1,有,有,有,19980,448,,0.0,0,,RPOQMLQJLHPFFCA18CC
內湖區,建物,臺北市內湖區成功路四段323巷1弄6號3樓,0.0,住,,,1090221,土地0建物1車位0,三層,4,公寓(5樓含以下無電梯),住家用,鋼筋混凝土造,0700311,97.08,2,2,2,有,無,有,27000,278,,0.0,0,,RPRQMLQJLHPFFCA48CC
中山區,建物,臺北市中山區明水路383號之1,0.0,住,,,1090225,土地0建物1車位0,一層,15,住宅大樓(11層含以上有電梯),住家用,鋼筋混凝土造,0850527,122.92,3,2,2,有,有,有,40000,325,,0.0,0,,RPTQMLQJLHPFFCA68CC
中山區,建物,臺北市中山區北安路608巷4弄3號,0.0,住,,,1090226,土地0建物1車位0,一層,4,店面(店鋪),住家用,鋼筋混凝土造,0601202,64.24,3,0,0,無,無,無,45408,707,,0.0,0,,RPUQMLQJLHPFFCA78CC
大同區,建物,臺北市大同區萬全街1號2樓之9,0.0,商,,,1090303,土地0建物1車位0,二層,15,住宅大樓(11層含以上有電梯),住家用,鋼筋混凝土造,1041016,126.94,2,1,2,有,無,有,80000,630,,0.0,0,,RPXNMLQJLHPFFBA68CC
中正區,建物,臺北市中正區濟南路2段15號3樓之7,0.0,住,,,1090219,土地0建物1車位1,三層,11,住宅大樓(11層含以上有電梯),見其他登記事項,鋼筋混凝土造,0960129,62.24,1,1,1,有,有,有,36500,586,塔式車位,0.0,0,,RPOOMLQJLHPFFBA87CC
信義區,建物,臺北市信義區吳興街441號,0.0,住,,,1090305,土地0建物1車位0,一層,6,店面(店鋪),商業用,鋼筋混凝土造,0770723,70.39,0,0,0,無,無,無,32000,455,,0.0,0,,RPUOMLQJLHPFFDA68CC
北投區,建物,臺北市北投區崇仰七路18號,0.0,住,,,1090211,土地0建物1車位1,全,2,透天厝,住家用,加強磚造,0560308,243.81,5,2,4,有,有,有,60000,246,一樓平面,25.83,0,,RPVOMLQJLHPFFEA88CC
文山區,建物,臺北市文山區試院路５２之２號二樓,0.0,住,,,1090215,土地0建物0車位0,二層,5,公寓(5樓含以下無電梯),住家用,鋼筋混凝土造,0700612,18.14,1,0,0,有,無,有,6000,331,,0.0,0,部分承租-雅房。,RPQNMLQJLHPFFAA87CC
文山區,建物,臺北市文山區景興路２３８巷９號,0.0,商,,,1090219,土地0建物1車位0,一層,9,店面(店鋪),商業用,鋼筋混凝土造,0880716,105.18,0,0,0,無,有,無,30000,285,,0.0,0,,RPRNMLQJLHPFFAA97CC
中正區,建物,臺北市中正區金門街３４巷２號四樓,0.0,住,,,1090225,土地0建物0車位0,四層,4,套房(1房1廳1衛),住家用,鋼筋混凝土造,0641229,23.45,1,0,1,有,無,有,8500,362,,0.0,0,此為分租套房，第4層共分成8間，一間平均面積約為23.45平方公尺,RPXNMLQJLHPFFAA58CC
文山區,建物,臺北市文山區興隆路二段154巷11號9樓之3,0.0,商,,,1090217,土地0建物1車位0,,10,華廈(10層含以下有電梯),見使用執照,鋼筋混凝土造,,110.5,3,2,2,有,無,有,31119,282,,0.0,0,,RPOOMLQJLHPFFAA77CC
大安區,房地(土地+建物),臺北市大安區敦化南路二段81巷47號2樓,33.94,住,,,1090228,土地1建物1車位0,二層,7,華廈(10層含以下有電梯),住家用,鋼筋混凝土造,0721007,168.97,4,2,2,有,無,無,60166,356,,0.0,0,,RPUNMLQJLHPFFFA88DC
信義區,房地(土地+建物),臺北市信義區忠孝東路五段375號11樓,6.13,商,,,1090305,土地3建物1車位0,十一層,11,住宅大樓(11層含以上有電梯),見其他登記事項,鋼筋混凝土造,0940531,40.56,1,1,1,有,有,有,26500,653,,0.0,0,,RPXNMLQJLHPFFDA98DC
中山區,建物,臺北市中山區民生東路一段51號11樓之1,0.0,商,,,1090217,土地0建物1車位0,十一層,12,辦公商業大樓,商業用,鋼筋混凝土造,0820604,150.33,1,0,2,有,有,無,65000,432,,0.0,0,,RPWQMLQJLHPFFCA09DC
大安區,建物,臺北市大安區復興南路一段126巷6號3樓,0.0,商,,,1090304,土地0建物1車位0,三層,5,公寓(5樓含以下無電梯),住家用,鋼筋混凝土造,,93.35,3,1,1,有,無,有,32000,343,,0.0,0,,RPTNMLQJLHPFFFA68CC
大安區,建物,臺北市大安區瑞安街208巷39號4樓之2,0.0,住,,,1090305,土地0建物1車位0,四層,7,華廈(10層含以下有電梯),住家用,鋼筋混凝土造,1040511,44.22,0,0,0,無,無,有,32000,724,,0.0,0,,RPXNMLQJLHPFFFA09CC
大安區,建物,臺北市大安區仁愛路三段136號十五樓,0.0,住,,,1090224,土地0建物0車位0,十五層,15,辦公商業大樓,住家用,鋼筋混凝土造,0730726,1079.72,0,0,0,無,有,無,630000,583,,0.0,0,承租部份面積含公設約326.615坪。,RPROMLQJLHPFFFA58CC
大安區,建物,臺北市大安區羅斯福路三段275號十一樓之2,0.0,商,,,1090226,土地0建物1車位0,十一層,14,住宅大樓(11層含以上有電梯),住家用,鋼筋混凝土造,0970131,78.48,2,1,1,有,有,有,33000,420,,0.0,0,,RPPNMLRJLHPFFFA38CC
士林區,建物,臺北市士林區福國路59號四樓,0.0,住,,,1090302,土地0建物1車位0,四層,15,住宅大樓(11層含以上有電梯),住家用,鋼筋混凝土造,1030411,215.01,3,2,2,有,有,有,111195,517,,0.0,0,,RPSNMLRJLHPFFEA58CC
士林區,建物,臺北市士林區雨聲街67號六樓,0.0,住,,,1090225,土地0建物1車位0,六層,7,華廈(10層含以下有電梯),住家用,鋼筋混凝土造,0740613,157.70999999999998,3,2,2,有,有,有,57000,361,,0.0,0,,RPTNMLRJLHPFFEA68CC
大同區,建物,臺北市大同區太原路80號十一樓之1,0.0,商,,,1090307,土地0建物1車位0,十一層,14,住宅大樓(11層含以上有電梯),住家用,鋼筋混凝土造,0971211,94.86,2,1,1,有,有,有,42000,443,,0.0,0,,RPSNMLRJLHPFFBA28CC
大同區,建物,臺北市大同區南京西路18巷6號三樓之3,0.0,商,,,1090225,土地0建物1車位0,三層,9,辦公商業大樓,見其他登記事項,鋼筋混凝土造,1001129,72.8,2,1,1,有,有,有,46500,639,,0.0,0,,RPTNMLRJLHPFFBA38CC
大同區,建物,臺北市大同區承德路一段46號10樓部分,0.0,商,,,1090226,土地0建物1車位0,十層,12,辦公商業大樓,商業用,鋼筋混凝土造,0721111,109.08,1,0,0,有,有,無,48000,440,,0.0,0,1.該建號部分出租，約33坪2.租金包含所得稅、二代健保,RPUNMLRJLHPFFBA48CC
中山區,建物,臺北市中山區松江路184巷26弄6號八樓之5,0.0,住,,,1090305,土地0建物1車位0,八層,9,華廈(10層含以下有電梯),住家用,鋼筋混凝土造,0971202,55.86,1,1,1,有,有,有,40000,716,,0.0,0,,RPWNMLRJLHPFFCA78CC
中山區,建物,臺北市中山區農安街6號三樓之6,0.0,商,,,1090227,土地0建物1車位0,三層,14,住宅大樓(11層含以上有電梯),商業用,鋼筋混凝土造,0980622,79.28999999999999,1,1,1,有,有,有,43000,542,,0.0,0,,RPXNMLRJLHPFFCA88CC
中山區,建物,臺北市中山區建國北路二段9之2號十三樓之8,0.0,住,,,1090229,土地0建物1車位0,十三層,14,辦公商業大樓,商業用,鋼筋混凝土造,0950713,75.9,1,1,1,有,有,有,66000,870,,0.0,0,,RPOOMLRJLHPFFCA08CC
中山區,建物,臺北市中山區建國北路2段9之2號7樓之9,0.0,住,,,1090301,土地0建物1車位0,七層,14,住宅大樓(11層含以上有電梯),商業用,鋼筋混凝土造,0950713,72.72999999999999,1,1,1,有,有,有,45000,619,,0.0,0,含管理費、稅金或水電等費用。；,RPRNMLSJLHPFFCA38CC
大同區,房地(土地+建物),臺北市大同區重慶北路三段334巷15弄3號3樓,19.89,住,,,1090218,土地2建物1車位0,三層,5,公寓(5樓含以下無電梯),住家用,鋼筋混凝土造,0741227,94.19,3,2,2,有,無,有,26000,276,,0.0,0,,RPRNMLSJLHPFFBA28CC
大同區,建物,臺北市大同區市民大道一段207號十四樓之12,0.0,其他,,,1090227,土地0建物1車位0,十四層,18,住宅大樓(11層含以上有電梯),住家用,見其他登記事項,0980724,43.12,1,1,1,有,有,有,27000,626,,0.0,0,租賃範圍不含車位，且無法區分車位面積。；含管理費、稅金或水電等費用。；,RPWOMLTJLHPFFBA98CC
信義區,建物,臺北市信義區松德路26號10樓,0.0,住,,,1090216,土地0建物1車位0,十層,12,住宅大樓(11層含以上有電梯),住家用,鋼筋混凝土造,,114.9,2,1,1,有,有,無,45000,392,,0.0,0,,RPSNMLTJLHPFFDA68CC
信義區,建物,臺北市信義區松德路65號3樓之4,0.0,住,,,1090224,土地0建物1車位0,三層,12,辦公商業大樓,商業用,鋼筋混凝土造,0810609,159.35,2,1,2,有,有,有,68000,427,,0.0,0,,RPOOMLTJLHPFFDA38CC
中山區,建物,臺北市中山區中山北路二段44號16樓,2913.0,商,,,1090301,土地0建物1車位1,見其他登記事項,16,辦公商業大樓,商業用,鋼骨鋼筋混凝土造,0800919,173.62,0,0,0,無,無,無,126048,726,坡道平面,0.0,0,,RPSOMLTJLHPFFCA68CC
中山區,建物,臺北市中山區建國北路二段147號10樓之5,0.0,住,,,1090213,土地0建物1車位0,十層,14,辦公商業大樓,住家用,鋼筋混凝土造,0710702,80.06,1,1,0,有,無,有,25000,312,,0.0,0,,RPWOMLTJLHPFFCA09CC
中山區,建物,臺北市中山區長春路128之1號四樓,0.0,商,,,1090305,土地0建物0車位0,四層,4,套房(1房1廳1衛),住家用,加強磚造,0560823,21.9,1,0,1,有,無,有,10800,493,,0.0,0,此為分租套房，第四層共分成4間，一間平均面積約為21.9平方公尺,RPXOMLTJLHPFFCA56CC
內湖區,建物,臺北市內湖區成功路4段41巷4號4樓,0.0,商,,,1090211,土地0建物1車位0,四層,14,住宅大樓(11層含以上有電梯),住家用,鋼筋混凝土造,0721024,115.89,3,2,2,有,無,有,35000,302,,0.0,0,,RPRPMLTJLHPFFCA68CC
中山區,建物,臺北市中山區中山北路二段16巷9號1樓,0.0,住,,,1090305,土地0建物1車位0,一層,4,店面(店鋪),住家用,加強磚造,0551227,59.0,0,0,0,無,無,有,140000,2373,,0.0,0,部分出租,RPWPMLTJLHPFFCA56CC
北投區,建物,臺北市北投區中央南路二段１２之１６號十二樓,0.0,工,,,1090216,土地0建物1車位0,十二層,19,其他,見其他登記事項,鋼筋混凝土造,1040828,50.980000000000004,1,1,1,有,有,有,16500,324,,0.0,0,租金含管理費。,RPVOMLTJLHPFFEA56CC
大安區,建物,臺北市大安區忠孝東路四段183號12樓之6,0.0,商,,,1090210,土地0建物1車位0,十二層,14,辦公商業大樓,住商用,鋼筋混凝土造,,90.93,1,1,1,有,有,有,39000,429,,0.0,0,,RPOOMLTJLHPFFFA58CC
信義區,建物,臺北市信義區忠孝東路五段508號6樓之1,0.0,住,,,1090221,土地0建物1車位0,六層,28,辦公商業大樓,商業用,鋼骨混凝土造,0820813,202.5,5,0,2,有,有,有,85000,420,,0.0,0,,RPUNMLTJLHPFFDA98DC
文山區,建物,臺北市文山區車前路11之1號二十三樓,0.0,商,,,1090309,土地0建物1車位3,二十三層,33,住宅大樓(11層含以上有電梯),住家用,鋼骨鋼筋混凝土造,1040427,183.20999999999998,3,2,2,有,有,有,49000,267,其他,0.0,0,,RPUPMLTJLHPFFAA78CC
文山區,建物,臺北市文山區景興路38號,0.0,住,,,1090222,土地0建物1車位0,一層,4,店面(店鋪),住家用,鋼筋混凝土造,,91.92,0,0,0,無,無,無,38000,413,,0.0,0,,RPWPMLTJLHPFFAA98CC
