鄉鎮市區,交易標的,土地位置建物門牌,土地面積平方公尺,都市土地使用分區,非都市土地使用分區,非都市土地使用編定,租賃年月日,租賃筆棟數,租賃層次,總樓層數,建物型態,主要用途,主要建材,建築完成年月,建物總面積平方公尺,建物現況格局-房,建物現況格局-廳,建物現況格局-衛,建物現況格局-隔間,有無管理組織,有無附傢俱,總額元,單價元平方公尺,車位類別,車位面積平方公尺,車位總額元,備註,編號
The villages and towns urban district,transaction sign,land sector position building sector house number plate,land shifting total area square meter,the use zoning or compiles and checks,the non-metropolis land use district,non-metropolis land use,transaction year month and day,transaction pen number,shifting level,total floor number,building state,main use,main building materials,construction to complete the years,building shifting total area,Building present situation pattern - room,building present situation pattern - hall,building present situation pattern - health,building present situation pattern - compartmented,Whether there is manages the organization,Whether there is attaches the furniture,total price NTD,the unit price (NTD / square meter),the berth category,berth shifting total area square meter,the berth total price NTD,the note,serial number
屏東市,房地(土地+建物),屏東縣屏東市華正路5號1樓,89.0,住,,,1090131,土地1建物1車位0,全,4,透天厝,住家用,鋼筋混凝土造,0781018,55.28,1,1,1,有,無,無,16000,289,,0.0,0,,RPQOMLLKKHPFFAT76CC
內埔鄉,建物,屏東縣內埔鄉康寧路248號,0.0,住,,,1090130,土地1建物0車位0,全,2,透天厝,住家用,加強磚造,0670915,112.4,3,2,2,有,無,無,11000,98,,0.0,0,屏東縣政府包租代管計畫,RPRNMLLKKHPFFCT96CC
屏東市,建物,屏東縣屏東市公裕街223巷12之3號,0.0,住,,,1090212,土地0建物1車位0,四層,5,公寓(5樓含以下無電梯),見其他登記事項,鋼筋混凝土造,0720510,81.45,3,2,1,有,無,有,10000,123,,0.0,0,屏東縣政府包租代管計畫,RPUNMLOKKHPFFAT37CC
屏東市,建物,屏東縣屏東市自由路95號3樓之3,0.0,住,,,1090219,土地0建物1車位0,三層,5,公寓(5樓含以下無電梯),住家用,鋼筋混凝土造,0720906,45.980000000000004,1,1,1,有,無,有,4500,98,,0.0,0,,RPPNMLKLKHPFFAT56CC
屏東市,建物,屏東縣屏東市自由路95號3樓之5,0.0,住,,,1090219,土地0建物1車位0,三層,5,公寓(5樓含以下無電梯),住家用,鋼筋混凝土造,0720906,45.980000000000004,1,1,1,有,無,有,4500,98,,0.0,0,,RPRNMLKLKHPFFAT76CC
屏東市,建物,屏東縣屏東市公裕街195巷12弄10之4號,0.0,住,,,1090221,土地0建物1車位0,五層,5,公寓(5樓含以下無電梯),見其他登記事項,鋼筋混凝土造,0701221,74.45,3,2,1,有,無,有,6000,81,,0.0,0,,RPTPMLLLKHPFFAT27CC
屏東市,房地(土地+建物),屏東縣屏東市工業路7號,4814.0,工,,,1090224,土地2建物0車位0,見其他登記事項,1,工廠,倉庫,鋼造,0691226,2188.61,0,0,0,無,無,無,180000,,,0.0,0,,RPUNMLMJLHPFFAT17CC
屏東市,房地(土地+建物)+車位,屏東縣屏東市機場北路570號8樓,8.69,住,,,1090227,土地1建物2車位1,八層,14,住宅大樓(11層含以上有電梯),見其他登記事項,鋼筋混凝土造,0881204,85.55,2,1,1,有,無,有,12000,140,其他,0.0,0,,RPROMLNJLHPFFAT17DC
內埔鄉,建物,屏東縣內埔鄉永興二巷23號,0.0,,鄉村區,乙種建築用地,1090303,土地1建物0車位0,全,4,透天厝,住宅,鋼筋混凝土構造,0820807,169.38,4,2,3,有,有,無,9000,53,,0.0,0,屏東縣政府包租代管計畫,RPQOMLOJLHPFFCT27CC
屏東市,房地(土地+建物),屏東縣屏東市公治一街5之4號,15.13,住,,,1090301,土地1建物0車位0,,5,公寓(5樓含以下無電梯),住家用,鋼筋混凝土造,0730804,106.10000000000001,3,2,2,有,無,無,7000,66,,0.0,0,,RPVOMLPJLHPFFAT67CC
屏東市,土地,和平段430地號,139.0,住,,,1090303,土地1建物0車位0,,,其他,,,,0.0,0,0,0,有,無,無,26000,187,,0.0,0,含增建或未登記建物。；,RPUNMLQJLHPFFAT67DC
里港鄉,房地(土地+建物),屏東縣里港鄉三和路11991&11992號,2438.05,,工業區,丁種建築用地,1090226,土地2建物0車位0,見其他登記事項,1,工廠,見其他登記事項,見其他登記事項,0881103,1297.57,0,0,0,無,無,無,150000,,,0.0,0,,RPSNMLTJLHPFFBT77CC
屏東市,房地(土地+建物),屏東縣屏東市武愛街108號,97.0,住,,,1090310,土地1建物0車位0,全,3,透天厝,住家用,鋼筋混凝土造,0951115,185.02,5,2,3,有,無,無,18000,97,,0.0,0,1.不能在屋內拜拜2.不能在屋內養寵物3.大門鎖3支.陽台鎖2把共2支,RPXNMLLKLHPFFAT47CC
屏東市,房地(土地+建物),屏東縣屏東市和平路210號一樓,51.6,住,,,1090213,土地1建物1車位0,全,3,透天厝,住商用,鋼筋混凝土造,0860702,101.4,1,0,0,無,無,無,25000,247,,0.0,0,,RPTNMLMKLHPFFAT27DC
屏東市,房地(土地+建物),屏東縣屏東市建國路217巷3弄15號,62.0,住,,,1090223,土地1建物0車位0,全,4,透天厝,住家用,鋼筋混凝土造,0801120,164.23,4,2,3,有,無,無,10000,61,,0.0,0,,RPTOMLMKLHPFFAT37DC
屏東市,土地,溝美段502-39地號,287.0,住,,,1090314,土地5建物0車位0,,,其他,,,,0.0,0,0,0,有,無,無,50000,174,,0.0,0,,RPSOMLQKLHPFFAT57CC
內埔鄉,建物,屏東縣內埔鄉德美路310號,0.0,住,,,1090318,土地1建物0車位0,全,8,透天厝,住家用,鋼筋混凝土造,0850109,149.97,4,2,2,有,有,無,12000,80,,0.0,0,屏東縣政府包租代管計畫,RPWNMLSKLHPFFCT28CC
屏東市,建物,屏東縣屏東市廣東路1430之2號10樓之1,0.0,住,,,1090320,土地0建物1車位0,十層,14,住宅大樓(11層含以上有電梯),見其他登記事項,鋼筋混凝土造,1070315,75.38,2,2,1,有,有,有,10000,133,,0.0,0,,RPUOMLKLLHPFFAT27CC
恆春鎮,房地(土地+建物),屏東縣恆春鎮樹林路25之2號,3121.27,,國家公園區,,1090327,土地1建物1車位0,,2,農舍,農舍,鋼筋混凝土造,0980601,310.23,0,0,0,無,有,有,60000,,,0.0,0,,RPSNMLKMLHPFFET47CC
內埔鄉,房地(土地+建物),屏東縣內埔鄉建工路8之2號,2363.0,,工業區,丁種建築用地,1090326,土地1建物0車位0,見其他登記事項,1,工廠,工業用,見使用執照,0840310,723.94,0,0,0,無,有,無,130000,,,0.0,0,承租方申請公司行號中,RPOPMLQJMHPFFCT47CC
內埔鄉,房地(土地+建物),屏東縣內埔鄉學人路695號,87.59,住,,,1090410,土地1建物0車位0,全,3,透天厝,住商用,鋼筋混凝土造,0781222,182.7,4,2,3,有,無,無,18000,99,,0.0,0,,RPQOMLKKMHPFFCT07CC
屏東市,房地(土地+建物),屏東縣屏東市華盛街25號8樓之3,45.58,住,,,1090409,土地1建物0車位0,,14,住宅大樓(11層含以上有電梯),集合住宅,鋼筋混凝土造,0930909,181.01,3,2,2,有,有,無,12000,66,,0.0,0,,RPXNMLOKMHPFFAT87CC
屏東市,土地,明正段972地號,267.0,其他,,,1090318,土地1建物0車位0,,,其他,,,,0.0,0,0,0,有,無,有,12500,47,,0.0,0,,RPTNMLQKMHPFFAT67CC
屏東市,土地,明正段999地號,272.0,其他,,,1090318,土地1建物0車位0,,,其他,,,,0.0,0,0,0,有,無,無,42500,156,,0.0,0,,RPVNMLQKMHPFFAT87CC
屏東市,房地(土地+建物),屏東縣屏東市民生東路743號,46.88,住,,,1090418,土地1建物1車位0,四層,5,公寓(5樓含以下無電梯),住家用,鋼筋混凝土造,0730706,100.15,3,2,1,有,無,有,7000,70,,0.0,0,,RPWOMLKLMHPFFAT57CC
屏東市,房地(土地+建物),屏東縣屏東市華盛街15號7樓之3,45.58,住,,,1090421,土地1建物0車位0,,14,住宅大樓(11層含以上有電梯),集合住宅,鋼筋混凝土造,0930909,181.01,3,2,2,有,有,無,14000,77,,0.0,0,,RPOOMLLLMHPFFAT86CC
長治鄉,土地,協華段958-4地號,190.0,,鄉村區,乙種建築用地,1090422,土地1建物0車位0,,,其他,,,,0.0,6,0,0,有,無,有,13500,71,,0.0,0,含增建或未登記建物。；,RPVOMLOLMHPFFAT87CC
屏東市,建物,屏東縣屏東市永大路87號4樓之1,0.0,住,,,1090429,土地0建物1車位0,四層,5,公寓(5樓含以下無電梯),國民住宅,鋼筋混凝土造,0831212,110.71,3,2,2,有,無,有,10000,90,,0.0,0,屏東縣政府包租代管計畫,RPTOMLTLMHPFFAT18CC
屏東市,房地(土地+建物),屏東縣屏東市廣東路718號,99.0,住,,,1090501,土地1建物1車位0,一層,3,店面(店鋪),住商用,鋼筋混凝土造,0680620,64.26,0,0,0,無,無,有,13000,202,,0.0,0,,RPQNMLOJNHPFFAT17CC
屏東市,建物,屏東縣屏東市豐華街17號7樓之2,0.0,住,,,1090505,土地0建物1車位0,七層,7,華廈(10層含以下有電梯),住家用,鋼筋混凝土造,0840120,129.51999999999998,3,2,2,有,有,有,12000,93,,0.0,0,,RPPOMLPJNHPFFAT27CC
屏東市,房地(土地+建物),屏東縣屏東市大連路38之3號,65.0,住,,,1090506,土地1建物0車位0,,2,店面(店鋪),住商用,鋼筋混凝土加強磚造,0580820,107.56,2,2,2,有,無,無,11000,102,,0.0,0,,RPQNMLQJNHPFFAT37CC
屏東市,房地(土地+建物),屏東縣屏東市公園西路135號,23.29,住,,,1090506,土地1建物0車位0,全,2,透天厝,住商用,加強磚造,0650507,33.26,0,0,0,無,無,無,12000,361,,0.0,0,,RPROMLQJNHPFFAT57CC
內埔鄉,房地(土地+建物),屏東縣內埔鄉學人路699號,88.05,住,,,1090415,土地1建物0車位0,全,3,透天厝,住商用,鋼筋混凝土造,0781222,182.7,4,2,3,有,無,無,18000,99,,0.0,0,1.承租如未滿一年，承租人搬遷時，屋內所有裝潢固定式交由出租人，自行處理，不得要求任何補償2.屋內不得飼養寵物及聚會喧嘩，未經同意不得轉租,RPPNMLRJNHPFFCT57CC
